{"schema_version":2,"story_id":null,"phase":"debate","context_revision":"tl-orchestrator@c873846+T002-medicao-AC03","catalog_revision":"PROJECT.md-perfil-de-despacho-2026-09-07","confidence":"high","facts":["A solicitação é consultiva, curta, de baixo risco, sem diff e sem escrita.","O orçamento é moderado; esforços max e ultra são proibidos.","As cadeias, pins e pares de modelo/effort devem respeitar o catálogo permitido.","Há preferência por independência do checker e não há autoria efetiva anterior nesta fase."],"uncertainties":["Não há story_id nem evidência de implementação concreta; a decisão permanece consultiva e pode mudar com novos artefatos."],"reclassify_when":["Reclassificar se surgir diff, necessidade de escrita, risco maior, autoria efetiva anterior ou uma story BMAD concreta."],"roles":{"planner":{"tier":"simple","reason":"Questão de decisão curta e baixo risco, sem necessidade de planejamento aprofundado.","candidates":[{"harness":"claude","model":"sonnet","effort":"medium","evidence_ids":["price-sonnet","sonnet-effort","transport-claude"],"cost_basis":"token_price_only","reason":"Par autorizado e adequado ao debate consultivo, com evidência de preço e esforço do Sonnet."},{"harness":"codex","model":"gpt-5.6-terra","effort":"medium","evidence_ids":["price-terra","gpt56-coding","transport-openai"],"cost_basis":"token_price_only","reason":"Par autorizado para análise moderada, com evidência econômica e de capacidade do Terra."},{"harness":"agy","model":"gemini-3.1-pro-high","effort":"high","evidence_ids":[],"cost_basis":"unknown","reason":"Par autorizado no catálogo para planner, mas sem evidência pertinente ou base econômica fornecida."}]},"maker":{"tier":"simple","reason":"A participação do maker é apenas uma opinião consultiva curta; não há implementação nem diff.","candidates":[{"harness":"agy","model":"gemini-3.8-flash-high","effort":"high","evidence_ids":["local-t009-maker-gemini","local-t010-maker-gemini","price-flash","transport-flash","flash-deepswe"],"cost_basis":"local_observed","reason":"Candidato pinado e preferido pelo usuário, autorizado para maker e respaldado por medições locais pertinentes."},{"harness":"codex","model":"gpt-5.6-terra","effort":"medium","evidence_ids":["price-terra","gpt56-coding","transport-openai"],"cost_basis":"token_price_only","reason":"Fallback autorizado para maker, adequado ao escopo consultivo e com evidência econômica pertinente."},{"harness":"claude","model":"sonnet","effort":"medium","evidence_ids":["price-sonnet","sonnet-effort","transport-claude"],"cost_basis":"token_price_only","reason":"Fallback autorizado para maker, suficiente para uma opinião curta e com evidência econômica pertinente."}]},"checker":{"tier":"simple","reason":"A verificação é consultiva, de baixo risco e deve permanecer independente, sem revisão de diff.","candidates":[{"harness":"codex","model":"gpt-6-astra","effort":"high","evidence_ids":["local-t005-checker-astra","local-t009-checker-astra","price-astra","astra-coding","astra-domain","transport-openai"],"cost_basis":"local_observed","reason":"Candidato pinado para checker, autorizado, independente nesta fase e respaldado por medições locais pertinentes."},{"harness":"claude","model":"sonnet","effort":"high","evidence_ids":["price-sonnet","sonnet-effort","transport-claude"],"cost_basis":"token_price_only","reason":"Fallback autorizado e independente, com esforço high exigido pelo catálogo de checker e evidência econômica pertinente."},{"harness":"agy","model":"gemini-3.1-pro-high","effort":"high","evidence_ids":[],"cost_basis":"unknown","reason":"Par autorizado no catálogo para checker, mas sem evidência pertinente ou base econômica fornecida."}]}}}