{"schema_version":2,"story_id":null,"phase":"debate","context_revision":"tl-orchestrator@c873846+T002-medicao-AC03","catalog_revision":"PROJECT.md-perfil-de-despacho-2026-09-07","confidence":"high","facts":["A sessão é consultiva, de baixo risco, sem diff e sem escrita.","A política prefere independência do checker e define orçamento moderado, com max/ultra proibidos.","As cadeias, pins, catálogo permitido e evidências econômicas foram fornecidos no briefing."],"uncertainties":["Sem diff ou story_id, a complexidade real da correção do shutdown não pode ser verificada além do briefing."],"reclassify_when":["Reclassificar se surgir diff, critérios técnicos detalhados, story BMAD vinculada ou mudança para execução de implementação/review."],"roles":{"planner":{"tier":"normal","reason":"A decisão de despacho envolve comparar BMAD 1.15e com Task Native e se beneficia de análise consultiva moderada, sem exigir esforço pesado.","candidates":[{"harness":"claude","model":"sonnet","effort":"medium","evidence_ids":["price-sonnet","sonnet-effort","transport-claude"],"cost_basis":"token_price_only","reason":"Candidato autorizado e adequado ao debate moderado; evidências sustentam preço e esforço do Sonnet."},{"harness":"codex","model":"gpt-5.6-terra","effort":"medium","evidence_ids":["price-terra","gpt56-coding","transport-openai"],"cost_basis":"token_price_only","reason":"Candidato autorizado e adequado ao debate moderado; evidências sustentam preço, capacidade e transporte do Terra."},{"harness":"agy","model":"gemini-3.1-pro-high","effort":"high","evidence_ids":[],"cost_basis":"unknown","reason":"Par autorizado no catálogo, porém não há evidência pertinente ao Gemini 3.1 Pro High nem base econômica fornecida."}]},"maker":{"tier":"normal","reason":"A opinião do maker é curta e consultiva, mas deve avaliar a fronteira entre correção de adapter e story BMAD; esforço moderado é suficiente.","candidates":[{"harness":"agy","model":"gemini-3.8-flash-high","effort":"high","evidence_ids":["local-t009-maker-gemini","local-t010-maker-gemini","price-flash","transport-flash","flash-deepswe"],"cost_basis":"local_observed","reason":"Candidato pinado e autorizado; medições locais pertinentes observam o Maker Gemini 3.8 Flash high."},{"harness":"codex","model":"gpt-5.6-terra","effort":"medium","evidence_ids":["price-terra","gpt56-coding","transport-openai"],"cost_basis":"token_price_only","reason":"Alternativa autorizada para análise técnica moderada, com evidências pertinentes de preço, capacidade e transporte."},{"harness":"claude","model":"sonnet","effort":"medium","evidence_ids":["price-sonnet","sonnet-effort","transport-claude"],"cost_basis":"token_price_only","reason":"Alternativa autorizada para opinião consultiva moderada, com evidências pertinentes de preço, esforço e transporte."}]},"checker":{"tier":"normal","reason":"A checagem deve preservar independência e testar a recomendação de despacho, mas o risco baixo e a ausência de diff não justificam tier pesado.","candidates":[{"harness":"codex","model":"gpt-6-astra","effort":"high","evidence_ids":["local-t005-checker-astra","local-t009-checker-astra","price-astra","astra-coding","astra-domain","transport-openai"],"cost_basis":"local_observed","reason":"Candidato pinado, autorizado e alinhado à preferência de independência; há medições locais pertinentes do Checker Astra high."},{"harness":"claude","model":"sonnet","effort":"high","evidence_ids":["price-sonnet","sonnet-effort","transport-claude"],"cost_basis":"token_price_only","reason":"Alternativa autorizada para checagem independente em esforço alto, com evidências pertinentes."},{"harness":"agy","model":"gemini-3.1-pro-high","effort":"high","evidence_ids":[],"cost_basis":"unknown","reason":"Par autorizado no catálogo, porém não há evidência pertinente ao Gemini 3.1 Pro High nem base econômica fornecida."}]}}}