{
  "schema_version": 2,
  "story_id": "T024",
  "phase": "review",
  "context_revision": "tl-orchestrator@b8598cb4da9f3b514fd9be9a23d87e028181b0ce+T024-spec-c1aa4c68fcdd4fe2+integration-content-2aca4f42bdd399c943ad4a5afeb403725018f6ae:0549648677c932c6",
  "catalog_revision": "PROJECT.md-perfil-de-despacho-2026-09-07",
  "confidence": "high",
  "facts": [
    "A fase a classificar é review (rodada r02) da tarefa T024 (Reconciliação de Linhagem de Governança e Integração T018/v0.11).",
    "A autoria acumulada de T024 é formalmente compartilhada entre Anthropic e Google (effective_authors: [google, anthropic]), com Anthropic atuando como Planner (Claude Opus r01 e Claude Sonnet r02) e parecer consultivo do Advisor prévio, e Google atuando como Maker da implementação (Agy Gemini 3.8 Flash High em r01 e r02).",
    "A política de independência mandatória e inegociável é checker_independence: required, tornando as famílias participantes Anthropic e Google estritamente inelegíveis para o papel Checker.",
    "A única família elegível no catálogo com independência total de família cruzada (cross-family) é OpenAI Codex (gpt-5.6-terra).",
    "O candidato primário obrigatório para Checker é codex: model: gpt-5.6-terra, effort: high, com base de custo token_price_only suportada pelas evidências price-terra, terra-effort e transport-codex.",
    "A entrega de implementação pós-rework r02 está congelada no target commit b8598cb4da9f3b514fd9be9a23d87e028181b0ce, com integration base 2aca4f42bdd399c943ad4a5afeb403725018f6ae, spec_revision c1aa4c68fcdd4fe2 e integration_content_id 2aca4f42bdd399c943ad4a5afeb403725018f6ae:0549648677c932c6 cobrindo 23 content_paths.",
    "O rework r02 resolveu os achados R1 (eliminação da autorreferência em AC25 com integration_target: recorded_in_evidence) e R2 (paridade exata das 5 propriedades canônicas de runtime_refs em schemas/batch.schema.json com docs/EXECUTION_PROTOCOL.md:512, sem aliases legados).",
    "A cadeia nominal autorizada para Checker no catálogo é codex -> claude -> agy, com apenas o primeiro candidato elegível sob checker_independence: required."
  ],
  "uncertainties": [
    "Disponibilidade operacional e latência de transporte do harness OpenAI Codex sob effort high durante a verificação completa da rodada r02.",
    "Tempo de execução e consumo de contexto necessários para auditar exaustivamente as correções de R1 e R2, a paridade canônica de runtime_refs e a suíte completa de testes de regressão."
  ],
  "reclassify_when": [
    "Houver indisponibilidade técnica de infraestrutura no harness Codex impossibilitando a execução de gpt-5.6-terra sob a exigência mandatória checker_independence: required.",
    "Ocorrer alteração na spec_revision c1aa4c68fcdd4fe2, desvio nos 23 content_paths ou novo commit desfazendo o target commit b8598cb4da9f3b514fd9be9a23d87e028181b0ce.",
    "A política de independência for flexibilizada para preferred pelo mantenedor, admitindo alternativas de mesma família em sessão limpa.",
    "O parecer da revisão r02 resultar em changes_requested demandando rodada r03 de retrabalho."
  ],
  "roles": {
    "checker": {
      "tier": "heavy",
      "reason": "Auditoria abrangente pós-rework r02 focando na resolução de R1 (eliminação da autorreferência em AC25 com recorded_in_evidence) e R2 (paridade exata das 5 propriedades canônicas de runtime_refs sem aliases legados), verificação da integridade relacional de governança L01–L14, conformidade dos 23 content_paths contra AC01–AC27 e regressão determinística dos testes.",
      "candidates": [
        {
          "harness": "codex",
          "model": "gpt-5.6-terra",
          "effort": "high",
          "evidence_ids": [
            "price-terra",
            "terra-effort",
            "transport-codex"
          ],
          "cost_basis": "token_price_only",
          "reason": "Candidato primário obrigatório e único elegível no catálogo com independência total de família cruzada (OpenAI) em relação aos autores Anthropic e Google; effort high adequado ao tier heavy."
        },
        {
          "harness": "claude",
          "model": null,
          "effort": null,
          "evidence_ids": [],
          "cost_basis": "unknown",
          "reason": "Inelegível por política de independência (checker_independence: required): a família Anthropic participou da autoria efetiva da Story T024 como Planner (r01 e r02) e Advisor prévio."
        },
        {
          "harness": "agy",
          "model": null,
          "effort": null,
          "evidence_ids": [],
          "cost_basis": "unknown",
          "reason": "Inelegível por política de independência (checker_independence: required): a família Google participou da autoria efetiva da Story T024 como Maker da implementação (r01 e r02)."
        }
      ]
    }
  }
}