{"schema_version":2,"story_id":null,"phase":"debate","context_revision":"tl-orchestrator@c873846+T002-medicao-AC03","catalog_revision":"PROJECT.md-perfil-de-despacho-2026-09-07","confidence":"high","facts":["A tarefa é consultiva, de baixo risco, sem diff e sem escrita, na fase debate.","Os pins vigentes priorizam agy Gemini 3.8 Flash high para maker e codex GPT-6 Astra high para checker.","O orçamento é moderado e max/ultra são proibidos."],"uncertainties":["Não há medição econômica local pertinente para gemini-3.1-pro-high."],"reclassify_when":["Houver diff, escrita efetiva, mudança de fase, aumento de risco ou remoção dos pins de maker/checker."],"roles":{"planner":{"tier":"simple","reason":"Debate consultivo curto, sem diff, com baixo risco e escopo delimitado.","candidates":[{"harness":"claude","model":"sonnet","effort":"medium","evidence_ids":["price-sonnet","sonnet-effort","transport-claude"],"cost_basis":"token_price_only","reason":"Opção elegível de custo moderado para análise consultiva; primeira alternativa da cadeia."},{"harness":"codex","model":"gpt-5.6-terra","effort":"medium","evidence_ids":["price-terra","gpt56-coding","transport-openai"],"cost_basis":"token_price_only","reason":"Opção elegível e adequada ao escopo curto, mantida como segunda alternativa da cadeia."},{"harness":"agy","model":"gemini-3.1-pro-high","effort":"high","evidence_ids":[],"cost_basis":"unknown","reason":"Par presente no catálogo e elegível, mas sem evidência pertinente de custo ou desempenho para esta tarefa."}]},"maker":{"tier":"simple","reason":"A opinião do maker é consultiva, curta, de baixo risco e não envolve implementação nem escrita.","candidates":[{"harness":"agy","model":"gemini-3.8-flash-high","effort":"high","evidence_ids":["local-t009-maker-gemini","local-t010-maker-gemini","price-flash","transport-flash","flash-deepswe"],"cost_basis":"local_observed","reason":"Candidato pinado e preferido pelo usuário; há medições locais pertinentes para Maker Gemini 3.8 Flash high."},{"harness":"codex","model":"gpt-5.6-terra","effort":"medium","evidence_ids":["price-terra","gpt56-coding","transport-openai"],"cost_basis":"token_price_only","reason":"Par válido no catálogo, mas inelegível nesta classificação porque o pin de maker exige agy Gemini 3.8 Flash high."},{"harness":"claude","model":"sonnet","effort":"medium","evidence_ids":["price-sonnet","sonnet-effort","transport-claude"],"cost_basis":"token_price_only","reason":"Par válido no catálogo, mas inelegível nesta classificação porque o pin de maker exige agy Gemini 3.8 Flash high."}]},"checker":{"tier":"simple","reason":"A verificação é independente, consultiva, curta e de baixo risco, sem diff nem efeitos de escrita.","candidates":[{"harness":"codex","model":"gpt-6-astra","effort":"high","evidence_ids":["local-t005-checker-astra","local-t009-checker-astra","price-astra","astra-coding","astra-domain","transport-openai"],"cost_basis":"local_observed","reason":"Candidato pinado para checker e alinhado à preferência de independência, com medições locais pertinentes."},{"harness":"claude","model":"sonnet","effort":"high","evidence_ids":["price-sonnet","sonnet-effort","transport-claude"],"cost_basis":"token_price_only","reason":"Par válido no catálogo, mas inelegível nesta classificação porque o pin de checker exige codex GPT-6 Astra high."},{"harness":"agy","model":"gemini-3.1-pro-high","effort":"high","evidence_ids":[],"cost_basis":"unknown","reason":"Par válido no catálogo, mas inelegível nesta classificação porque o pin de checker exige codex GPT-6 Astra high; não há evidência econômica pertinente."}]}}}